{
  "branches": [
    {
      "branch_id": "known-horizon-exploration",
      "created_by_event_id": "round-04.human-spec-decision",
      "lineage_relation": "separate_model_branch",
      "parent_branch_id": "unknown-horizon-target-verifier-v2",
      "parent_progress_credit": false,
      "specification_id": "minimax-known-horizon-v1",
      "specification_sha256": "533b994ba02f8708951f058ed3d776afbe33ca97e362d2786cd0cab0cb4b03eb",
      "specification_version": "1.2.0",
      "status": "researching",
      "target_lineage_id": "known-horizon-exploration:target-lineage"
    },
    {
      "branch_id": "unknown-horizon-target",
      "created_by_event_id": "specification.registered",
      "lineage_relation": "root",
      "parent_branch_id": null,
      "parent_progress_credit": false,
      "specification_id": "minimax-unknown-horizon-v1",
      "specification_sha256": "c586a0f066535135ab582ed77485512b1b68bc6327b114de2cac80fcdd2b9d36",
      "specification_version": "1.0.0",
      "status": "superseded",
      "target_lineage_id": "unknown-horizon-target:target-lineage"
    },
    {
      "branch_id": "unknown-horizon-target-verifier-v2",
      "created_by_event_id": "round-02.human-spec-decision",
      "lineage_relation": "accepted_successor",
      "parent_branch_id": "unknown-horizon-target",
      "parent_progress_credit": false,
      "specification_id": "minimax-unknown-horizon-verifier-v2",
      "specification_sha256": "ea0bb7f9d17dc1f3d4d49968b43711411f6b4ffb79c641589b7443046b7dec1f",
      "specification_version": "1.1.0",
      "status": "candidate_ready_for_semantic_review",
      "target_lineage_id": "unknown-horizon-target:target-lineage"
    }
  ],
  "candidates": [
    {
      "branch_id": "unknown-horizon-target",
      "candidate_id": "horizon-tuned-declared-certificate",
      "control_status": "target_compatible_control_pass",
      "diagnosis_event_id": "round-01.diagnosis",
      "human_judgment_event_id": "round-01.human-solution-judgment",
      "parent_progress_credit": false,
      "scientific_claim_status": "not_established",
      "specification_id": "minimax-unknown-horizon-v1",
      "specification_sha256": "c586a0f066535135ab582ed77485512b1b68bc6327b114de2cac80fcdd2b9d36",
      "target_lineage_id": "unknown-horizon-target:target-lineage",
      "verifier_results": [
        {
          "diagnostic_code": "assumption_scope_match",
          "limitation": "Does not establish that an algorithm or cited theorem truly satisfies those declarations.",
          "semantic_scope": "Checks exact equality of declared candidate and target assumption fields.",
          "status": "pass",
          "type": "assumption_exact_match",
          "verifier_id": "declared-assumption-interface"
        },
        {
          "diagnostic_code": "target_rate_signature_match",
          "limitation": "Does not prove a regret bound, constants, uniformity, or applicability of a source theorem.",
          "semantic_scope": "Checks exact equality of registered polynomial and logarithmic rate signatures.",
          "status": "pass",
          "type": "rate_signature_exact_match",
          "verifier_id": "declared-rate-signature"
        }
      ]
    },
    {
      "branch_id": "unknown-horizon-target-verifier-v2",
      "candidate_id": "horizon-tuned-declared-certificate-replay",
      "control_status": "failed_control_checks",
      "diagnosis_event_id": "round-03.diagnosis",
      "human_judgment_event_id": null,
      "parent_progress_credit": false,
      "scientific_claim_status": "not_established",
      "specification_id": "minimax-unknown-horizon-verifier-v2",
      "specification_sha256": "ea0bb7f9d17dc1f3d4d49968b43711411f6b4ffb79c641589b7443046b7dec1f",
      "target_lineage_id": "unknown-horizon-target:target-lineage",
      "verifier_results": [
        {
          "diagnostic_code": "assumption_scope_match",
          "limitation": "Does not establish that an algorithm or cited theorem truly satisfies those declarations.",
          "semantic_scope": "Checks exact equality of declared candidate and target assumption fields.",
          "status": "pass",
          "type": "assumption_exact_match",
          "verifier_id": "declared-assumption-interface"
        },
        {
          "diagnostic_code": "information_interface_mismatch",
          "limitation": "Checks a declared interface field only and does not inspect executable algorithm code or theorem assumptions.",
          "semantic_scope": "Compares the candidate's separately declared horizon-information interface with the branch assumption.",
          "status": "fail",
          "type": "information_interface_exact_match",
          "verifier_id": "declared-horizon-information-interface"
        },
        {
          "diagnostic_code": "target_rate_signature_match",
          "limitation": "Does not prove a regret bound, constants, uniformity, or applicability of a source theorem.",
          "semantic_scope": "Checks exact equality of registered polynomial and logarithmic rate signatures.",
          "status": "pass",
          "type": "rate_signature_exact_match",
          "verifier_id": "declared-rate-signature"
        }
      ]
    },
    {
      "branch_id": "unknown-horizon-target-verifier-v2",
      "candidate_id": "anytime-square-root-declared-certificate",
      "control_status": "target_compatible_control_pass",
      "diagnosis_event_id": "round-05.diagnosis",
      "human_judgment_event_id": "round-05.human-solution-judgment",
      "parent_progress_credit": false,
      "scientific_claim_status": "not_established",
      "specification_id": "minimax-unknown-horizon-verifier-v2",
      "specification_sha256": "ea0bb7f9d17dc1f3d4d49968b43711411f6b4ffb79c641589b7443046b7dec1f",
      "target_lineage_id": "unknown-horizon-target:target-lineage",
      "verifier_results": [
        {
          "diagnostic_code": "assumption_scope_match",
          "limitation": "Does not establish that an algorithm or cited theorem truly satisfies those declarations.",
          "semantic_scope": "Checks exact equality of declared candidate and target assumption fields.",
          "status": "pass",
          "type": "assumption_exact_match",
          "verifier_id": "declared-assumption-interface"
        },
        {
          "diagnostic_code": "information_interface_match",
          "limitation": "Checks a declared interface field only and does not inspect executable algorithm code or theorem assumptions.",
          "semantic_scope": "Compares the candidate's separately declared horizon-information interface with the branch assumption.",
          "status": "pass",
          "type": "information_interface_exact_match",
          "verifier_id": "declared-horizon-information-interface"
        },
        {
          "diagnostic_code": "target_rate_signature_match",
          "limitation": "Does not prove a regret bound, constants, uniformity, or applicability of a source theorem.",
          "semantic_scope": "Checks exact equality of registered polynomial and logarithmic rate signatures.",
          "status": "pass",
          "type": "rate_signature_exact_match",
          "verifier_id": "declared-rate-signature"
        }
      ]
    }
  ],
  "event_chain_head_sha256": "4c9717fb4e831944b4fe2dcd33e032397d462e7eb1c698746af6f516fba1ff5f",
  "events": [
    {
      "actor": "human",
      "branch_id": "unknown-horizon-target",
      "consumes": [],
      "details": {
        "authorization": "human_specification_authority",
        "parent_progress_credit": false,
        "status": "active",
        "subject_id": "minimax-unknown-horizon-v1",
        "summary": "The human registered the initial model, target, assumptions, and verifier suite."
      },
      "emits": [
        "begin_research_under_registered_specification"
      ],
      "event_id": "specification.registered",
      "event_index": 0,
      "event_sha256": "45d12a4f713a7897cda0302b979e43ecb07e955be63dd13bdad8429f76a2e1a7",
      "event_type": "specification_registered",
      "previous_event_sha256": "0000000000000000000000000000000000000000000000000000000000000000",
      "round_id": "setup",
      "source_payload_sha256": "dcbf1bca15483739f6a3f321034c3950ea49a24a7dd532e9d73a2817ff097be7",
      "specification_id": "minimax-unknown-horizon-v1",
      "specification_sha256": "c586a0f066535135ab582ed77485512b1b68bc6327b114de2cac80fcdd2b9d36"
    },
    {
      "actor": "ai",
      "branch_id": "unknown-horizon-target",
      "consumes": [
        {
          "event_id": "specification.registered",
          "event_sha256": "45d12a4f713a7897cda0302b979e43ecb07e955be63dd13bdad8429f76a2e1a7",
          "response_code": "begin_research_under_registered_specification"
        }
      ],
      "details": {
        "authorization": "ai_proposal_only_not_evidence",
        "parent_progress_credit": false,
        "status": "proposal_received",
        "subject_id": "horizon-tuned-declared-certificate",
        "summary": "Replay a horizon-tuned declared certificate whose rate matches while its information interface is recorded separately."
      },
      "emits": [
        "run_registered_control_verifiers"
      ],
      "event_id": "round-01.submission",
      "event_index": 1,
      "event_sha256": "3e2bb9b73bea09e86e0014d6d3c6997a33c527ec533537d06256792b3cc31f67",
      "event_type": "ai_solution_submission",
      "previous_event_sha256": "45d12a4f713a7897cda0302b979e43ecb07e955be63dd13bdad8429f76a2e1a7",
      "round_id": "round-01",
      "source_payload_sha256": "ee9138e96ec3292c3192a335fd52b80cd3dc96f8c46bd260ee741a836463aef2",
      "specification_id": "minimax-unknown-horizon-v1",
      "specification_sha256": "c586a0f066535135ab582ed77485512b1b68bc6327b114de2cac80fcdd2b9d36"
    },
    {
      "actor": "system",
      "branch_id": "unknown-horizon-target",
      "consumes": [
        {
          "event_id": "round-01.submission",